{
  "schemaVersion": 3,
  "id": "kuumetsu-first-combat-agency-20260922",
  "game": "kuumetsu",
  "mode": "evolution",
  "kind": "gameplay",
  "themeKey": "first-combat-agency-clarity",
  "experienceGoal": {
    "playerProblem": "初回接敵で自動戦闘へ切り替わる時、攻撃が自動か、プレイヤー入力が何に効くか判断できない。",
    "targetState": "接敵前に自動戦闘を予告し、接敵中も攻撃は自動・スワイプは間合い/離脱に使えると確認できる。",
    "successSignals": [
      "初回guideに接敵→自動戦闘が見える。",
      "戦闘中readoutに自動戦闘とスワイプの役割が見える。",
      "Tidebreak/接敵自動戦闘/input semanticsを変えない。"
    ]
  },
  "rootCauses": [
    {
      "key": "first-hunt-guide-omits-auto-combat-contract",
      "summary": "初回guideは移動/徘徊のみで接敵→自動戦闘を予告しない。",
      "revision": "1b52e6ad3cb1c18c149a61508de648bdd4236199",
      "path": "apps/demon/src/web/main.js",
      "symbol": "claimAndEnter first-hunt guide",
      "evidence": "browser-observed source blob 5753737d8192341e8dc463a685ae71c29ad53d09 is identical at f2266ceb, Before 998b5176, and base 1b52e6ad.",
      "prediction": "guideに近づく→自動戦闘と離脱操作を加えると接敵前に責任範囲が分かる。",
      "falsifier": "guideが移動だけ、または手動攻撃が必要に見える。",
      "paths": [
        "apps/demon/src/web/main.js"
      ]
    },
    {
      "key": "combat-readout-shows-state-not-player-agency",
      "summary": "戦闘readoutは序破急/技状態を示すが自動戦闘と残る入力を示さない。",
      "revision": "1b52e6ad3cb1c18c149a61508de648bdd4236199",
      "path": "apps/demon/src/web/combat-readout-flow.js",
      "symbol": "combat-feed-baseline",
      "evidence": "browser-observed source blob b68327f804147c793d74b8487f5f64334261b4b2 is identical at f2266ceb, Before 998b5176, and base 1b52e6ad.",
      "prediction": "baselineに自動戦闘・スワイプ間合いを出すと接敵中に責任範囲を確認できる。",
      "falsifier": "接敵中に役割が読めないか、新しい操作を示唆する。",
      "paths": [
        "apps/demon/src/web/combat-readout-flow.js",
        "apps/demon/src/web/main.js"
      ]
    }
  ],
  "workItems": [
    {
      "id": "teach-contact-transition",
      "summary": "初回guideへ接敵自動戦闘と距離離脱を追加する。",
      "rootCauseKeys": [
        "first-hunt-guide-omits-auto-combat-contract"
      ],
      "paths": [
        "apps/demon/src/web/main.js"
      ],
      "evidence": "hunt-loop-native assertionでplayer-facing guide contractを固定する。"
    },
    {
      "id": "label-live-combat-agency",
      "summary": "combat baselineへ自動戦闘とスワイプ間合いを追加する。",
      "rootCauseKeys": [
        "combat-readout-shows-state-not-player-agency"
      ],
      "paths": [
        "apps/demon/src/web/combat-readout-flow.js"
      ],
      "evidence": "hunt-loop-native assertionでcombat baseline contractを固定する。"
    }
  ],
  "observation": {
    "summary": "Before 998b5176をPer-App DEV Publish run 35659443178へ固定。Worker version b8ba1e36-15e3-405f-ba1f-54ceaacc5737、artifact 10667110028のversion.json.commit一致を確認。直接preview browser navigation不可のため、official native browser run 35650389669の実プレイを、該当2 source blobがBefore/現baseまでbyte-identicalであることを確認して利用。実プレイでは初回guideは移動/徘徊だけ、最初の自動戦闘は序破急/間合い表示だけだった。",
    "staging": {
      "kind": "immutable-staging",
      "sourceSha": "998b5176b6378679ea0417647ef14d6fee1810f4",
      "reference": "https://b8ba1e36-soul-lineage-demon-dev.c-okamoto.workers.dev/",
      "observedAt": "2026-09-21T21:51:26Z",
      "conditions": {
        "publishRun": 35659443178,
        "artifactId": 10667110028,
        "versionId": "b8ba1e36-15e3-405f-ba1f-54ceaacc5737",
        "versionJsonCommitMatched": true,
        "browserRun": 35650389669,
        "viewport": [
          673,
          841
        ],
        "blobIdentityVerified": true
      },
      "notVerified": [
        "fresh remote-browser navigation of b8ba1e36 from this execution surface",
        "physical Pixel Fold feel"
      ]
    },
    "candidateProblems": [
      {
        "id": "first-combat-agency",
        "selected": true,
        "statement": "接敵後の操作責任が読めない。"
      },
      {
        "id": "return-route-execution",
        "selected": false,
        "statement": "帰還口への実行導線が弱い。 recent retreat themeと近い。"
      },
      {
        "id": "combat-source-attribution",
        "selected": false,
        "statement": "戦闘feedの敵味方帰属が弱い。"
      },
      {
        "id": "hunt-entry-residual-cost",
        "selected": false,
        "statement": "hunt-entryが重い。 recent performance doNotRetry対象。"
      }
    ],
    "evidence": [
      {
        "kind": "source",
        "revision": "998b5176b6378679ea0417647ef14d6fee1810f4",
        "path": "apps/demon/src/web/main.js",
        "symbol": "claimAndEnter first-hunt guide",
        "statement": "Actual browser guide showed only movement/roam; exact Before source also omits contact-to-auto-combat."
      },
      {
        "kind": "source",
        "revision": "998b5176b6378679ea0417647ef14d6fee1810f4",
        "path": "apps/demon/src/web/combat-readout-flow.js",
        "symbol": "combat-feed-baseline",
        "statement": "Actual browser fight showed sequence/spacing state only; exact Before baseline omits auto-combat/swipe responsibility."
      },
      {
        "kind": "git-tree",
        "revision": "1b52e6ad3cb1c18c149a61508de648bdd4236199",
        "path": "apps/demon",
        "symbol": "998b5176..1b52e6ad affected scope",
        "statement": "Develop drift changed no apps/demon file, so both observed root-cause blobs are unchanged."
      }
    ]
  },
  "hypothesis": {
    "cause": "navigation説明とcombat表示が、接敵時の操作責任の変化を一つの契約として接続していない。",
    "prediction": "接敵前guideと接敵中baselineを接続すれば、攻撃は自動・スワイプは間合い/離脱と理解できる。",
    "falsifier": "AfterでどちらかのsuccessSignalが成立しない、またはmechanics変更が必要になる。"
  },
  "candidates": [
    {
      "id": "contextual-agency-bundle",
      "selected": true,
      "reason": "既存guide/readoutだけで前後を接続しmechanicsを変えない。"
    },
    {
      "id": "add-manual-attack",
      "selected": false,
      "reason": "protectedな接敵自動戦闘を変更する。"
    },
    {
      "id": "rename-phases-only",
      "selected": false,
      "reason": "序破急のcopyだけでは入力責任が分からない。"
    }
  ],
  "implementation": {
    "paths": [
      "apps/demon/src/web/main.js",
      "apps/demon/src/web/combat-readout-flow.js",
      "apps/demon/tests/hunt-loop-native.test.mjs"
    ],
    "summary": "初回guideとcombat baselineを同じagency contractで接続する。"
  },
  "evidencePlan": {
    "objective": "reproducible-causality",
    "focusedTests": [
      "apps/demon/tests/hunt-loop-native.test.mjs"
    ],
    "stagingAfter": "required",
    "limitations": [
      "balance probeはDOM copy coverage外。",
      "staging browser制約はreceiptにnotVerifiedとして残す。"
    ],
    "workItemCoverage": [
      {
        "workItemId": "teach-contact-transition",
        "evidence": "native source-contract assertion for first guide."
      },
      {
        "workItemId": "label-live-combat-agency",
        "evidence": "native source-contract assertion for combat baseline."
      }
    ]
  },
  "receipt": {
    "repository": "charukun/soul-lineage",
    "pullRequest": 1370,
    "marker": "autonomous-receipt:kuumetsu:kuumetsu-first-combat-agency-20260922"
  }
}
